{
  "$schema": "https://json-schema.org/draft/2020-12/schema",
  "$id": "qualification-evidence-record.schema.json",
  "title": "Qualification Evidence Record",
  "description": "Reference-only bounded qualification for a person, team, or organization. Does not store sensitive identity information. Access, clearance, position, or training attendance do not equal qualification. Qualification for one role or context does not imply another. Record outcome (QUALIFIED, CONDITIONAL, NOT_QUALIFIED) is distinct from temporal readiness. Interval endpoints are inclusive: a qualification can satisfy readiness only when outcome is QUALIFIED and qualified_from <= evaluation_time <= expires_at. evaluation_time < qualified_from is NOT_YET_EFFECTIVE. evaluation_time > expires_at is EXPIRED. Neither can satisfy readiness. qualified_from must be strictly before expires_at. NOT_QUALIFIED cannot become positive evidence. A future qualification is not current qualification.",
  "type": "object",
  "additionalProperties": false,
  "properties": {
    "schema_version": {
      "type": "string",
      "const": "1.0.0",
      "minLength": 1
    },
    "qualification_id": {
      "type": "string",
      "minLength": 1
    },
    "principal_ref": {
      "type": "string",
      "minLength": 1
    },
    "principal_type": {
      "type": "string",
      "enum": ["PERSON", "TEAM", "ORGANIZATION"],
      "minLength": 1
    },
    "role": {
      "type": "string",
      "minLength": 1
    },
    "scope": {
      "type": "string",
      "minLength": 1
    },
    "subject_id": {
      "type": "string",
      "minLength": 1
    },
    "configuration_digest": {
      "type": "string",
      "pattern": "^sha256:[a-f0-9]{64}$"
    },
    "environment": {
      "type": "string",
      "minLength": 1
    },
    "competence_evidence_refs": {
      "type": "array",
      "minItems": 1,
      "items": {
        "type": "string",
        "minLength": 1
      }
    },
    "qualified_from": {
      "type": "string",
      "pattern": "^\\d{4}-\\d{2}-\\d{2}T\\d{2}:\\d{2}:\\d{2}Z$"
    },
    "expires_at": {
      "type": "string",
      "pattern": "^\\d{4}-\\d{2}-\\d{2}T\\d{2}:\\d{2}:\\d{2}Z$"
    },
    "limitations": {
      "type": "array",
      "minItems": 1,
      "items": {
        "type": "string",
        "minLength": 1
      }
    },
    "relief_ready": {
      "type": "boolean"
    },
    "outcome": {
      "type": "string",
      "enum": ["QUALIFIED", "CONDITIONAL", "NOT_QUALIFIED"],
      "minLength": 1
    },
    "reference_only": {
      "type": "boolean",
      "const": true
    },
    "human_review_required": {
      "type": "boolean",
      "const": true
    },
    "authority_effect": {
      "type": "string",
      "const": "NONE"
    }
  },
  "required": [
    "schema_version",
    "qualification_id",
    "principal_ref",
    "principal_type",
    "role",
    "scope",
    "subject_id",
    "environment",
    "competence_evidence_refs",
    "qualified_from",
    "expires_at",
    "limitations",
    "outcome",
    "reference_only",
    "human_review_required",
    "authority_effect"
  ]
}
